Seja bem vindo a mais uma de nossas simulações. Dessa vez você escolheu a simulação de plano inclinado. Nosso sistema continua com as mesmas configurações, ou seja, não há atrito no ar e sua gravidade é de 10 m/s². Você pode explorar esse ambiente através de nosso menu de configurações!
Um objeto, ao ser solto em uma superfície inclinada, tende a sofrer uma força que o puxa em direção ao solo. É por isso que precisamos fazer mais esforço quando estamos subindo uma rua inclinada, ou conseguimos deslizar em um escorregador. A área de estudo nesse contexto é chamada de plano inclinado.
O plano inclinado possui diversas aplicações. Na robótica utilizamos essa área da física para calcular o torque necessário para os motores dos robôs. Mas da onde surge a força que faz os objetos se moverem na rampa? 
Quando um objeto é colocado em uma rampa 3 principais forças atuam sobre ele: peso, normal e, em alguns casos, a força de atrito. Uma das componentes da força peso acaba contribuindo para que esse objeto se desloque para a parte mais baixa da rampa. Ao contrário da força de atrito que se opõem ao deslocamento e dificulta o deslizamento. 
Agora que você já revisou como funciona o plano inclinado, vamos testar o seu conhecimento! Seu objetivo nessa fase é setar a inclinação da rampa e o peso do cubo e chegar no portal no tempo correto.
Cuidado! Meus sensores indicam que o inimigo está vindo do céu. Seja rápido e preciso, você terá três tentativas para alcançar o portal, caso contrário eles irão te atacar. Se você perder, clique novamente em mim para que eu restaure seus corações. Boa sorte!  
